{
  "schemaVersion": "1.0.0",
  "id": "daily-plan-2026-10-12",
  "date": "2026-10-12",
  "timezone": "Asia/Tehran",
  "status": "example",
  "generatedAt": "2026-10-11",
  "dataAsOf": "2026-10-09",
  "dataMode": "historical-reference",
  "title": "پلن معاملاتی روزانه | طلا و یورو/دلار",
  "summary": "طلا دوطرفه و حساس به تیترها؛ EURUSD با سوگیری فروش مشروط. هیچ سناریویی بدون داده تازه، trigger قیمت و نقطه ابطال قابل اجرا نیست.",
  "context": [
    "قیمت‌های عددی این نمونه از مرجع بسته‌شدن جمعه ۹ اکتبر ۲۰۲۶ گرفته شده‌اند؛ قیمت زنده یا قیمت تضمین‌شده کارگزار نیستند.",
    "ریسک ژئوپلیتیک و تیترهای فوری ممکن است گپ، اسپرد غیرعادی یا برگشت تند ایجاد کنند. تیتر و پاسخ رسمی را مجدداً از منابع معتبر بررسی کن.",
    "تعطیلی بازار اوراق آمریکا لزوماً به معنی تعطیلی FX/CFD یا بازار سهام نیست؛ ساعات و شرایط را در کارگزار بررسی کن.",
    "وزن سناریوها در سند نمونه فقط برآورد ذهنی است، نه احتمال آماری یا خروجی بک‌تست."
  ],
  "scenarioWeights": [
    {
      "label": "رنج / شکست کاذب",
      "weight": 40,
      "note": "برآورد ذهنی نمونه؛ نه احتمال آماری"
    },
    {
      "label": "حرکت خبری و برگشت",
      "weight": 35,
      "note": "برآورد ذهنی نمونه؛ نه احتمال آماری"
    },
    {
      "label": "شکست معتبر و ادامه",
      "weight": 25,
      "note": "برآورد ذهنی نمونه؛ نه احتمال آماری"
    }
  ],
  "instruments": [
    {
      "symbol": "XAUUSD",
      "name": "طلا",
      "priority": 1,
      "bias": "دوطرفه",
      "biasKey": "neutral",
      "digits": 2,
      "referenceLevelId": "xau-close",
      "note": "حساسیت بالا به دلار، بازده اوراق و تیترهای ریسک؛ از دنبال‌کردن کندل کشیده خودداری کن.",
      "levels": [
        {
          "id": "xau-target-up-2",
          "label": "هدف صعودی بالاتر · ۲ اکتبر",
          "price": 4225.77,
          "type": "target",
          "date": "2026-10-02"
        },
        {
          "id": "xau-friday-high",
          "label": "سقف جمعه · مقاومت اولیه",
          "price": 4207.28,
          "type": "resistance",
          "date": "2026-10-09"
        },
        {
          "id": "xau-close",
          "label": "بسته‌شدن جمعه · مرجع تاریخی",
          "price": 4192.86,
          "type": "reference",
          "date": "2026-10-09"
        },
        {
          "id": "xau-mid",
          "label": "میانه محدوده جمعه",
          "price": 4174.29,
          "type": "mid",
          "date": "2026-10-09"
        },
        {
          "id": "xau-friday-low",
          "label": "کف جمعه · حمایت اولیه",
          "price": 4141.3,
          "type": "support",
          "date": "2026-10-09"
        },
        {
          "id": "xau-target-down-1",
          "label": "کف ۸ اکتبر · هدف نزولی",
          "price": 4105.22,
          "type": "target",
          "date": "2026-10-08"
        },
        {
          "id": "xau-target-down-2",
          "label": "کف ۷ اکتبر · سطح پایین‌تر",
          "price": 4066.31,
          "type": "target",
          "date": "2026-10-07"
        }
      ],
      "scenarios": [
        {
          "id": "xau-sweep-low-long",
          "name": "Sweep کف و بازپس‌گیری",
          "direction": "long",
          "kind": "بازگشت از نقدینگی",
          "triggerLevelId": "xau-friday-low",
          "targetLevelIds": [
            "xau-mid",
            "xau-close",
            "xau-friday-high"
          ],
          "invalidationLevelId": "xau-friday-low",
          "entryMethod": "پس از reclaim سطح و شکست سقف فرعی M5؛ ورود روی retest، نه وسط کندل.",
          "confirmation": [
            "نفوذ زیر کف آسیا یا کف جمعه بدون ادامه فروش",
            "بسته‌شدن M5 دوباره بالای سطح",
            "شکست سقف فرعی M5 و retest معتبر"
          ],
          "stopMethod": "پشت کمینه sweep به‌علاوه بافر متناسب با اسپرد و نوسان.",
          "invalidation": "بسته‌شدن M15 زیر کف sweep و ادامه فروش.",
          "requirements": [
            "دلار جهش یک‌طرفه نداشته باشد",
            "تا مانع بعدی حداقل 1.5R فضای قابل دفاع باشد"
          ]
        },
        {
          "id": "xau-sweep-high-short",
          "name": "Sweep سقف و برگشت",
          "direction": "short",
          "kind": "بازگشت از نقدینگی",
          "triggerLevelId": "xau-friday-high",
          "targetLevelIds": [
            "xau-close",
            "xau-mid",
            "xau-friday-low"
          ],
          "invalidationLevelId": "xau-friday-high",
          "entryMethod": "پس از بسته‌شدن M5 زیر سطح و شکست کف فرعی؛ روی retest شکست ناموفق.",
          "confirmation": [
            "نفوذ بالای سقف آسیا یا سقف جمعه بدون تثبیت",
            "بسته‌شدن M5 زیر سطح",
            "شکست کف فرعی M5 و retest نزولی"
          ],
          "stopMethod": "پشت سقف sweep با بافر متناسب با اسپرد/نوسان.",
          "invalidation": "تثبیت M15 بالای 4207.28.",
          "requirements": [
            "از معامله روی تیتر بدون تأیید قیمت اجتناب شود",
            "تا هدف بعدی حداقل 1.5R فضای قابل دفاع باشد"
          ]
        },
        {
          "id": "xau-break-high-long",
          "name": "شکست معتبر سقف جمعه",
          "direction": "long",
          "kind": "ادامه روند",
          "triggerLevelId": "xau-friday-high",
          "targetLevelIds": [
            "xau-target-up-2"
          ],
          "invalidationLevelId": "xau-friday-high",
          "entryMethod": "بسته‌شدن M15 بالای سطح، retest موفق از بالا و ساختار higher-high / higher-low روی M5.",
          "confirmation": [
            "کلوز M15 بالای مقاومت",
            "retest از بالا حفظ شود",
            "M5 سقف و کف بالاتر بسازد"
          ],
          "stopMethod": "زیر swing بی‌اعتباری؛ بافر طبق نوسان/اسپرد.",
          "invalidation": "بازپس‌گیری سطح به سمت پایین یا close M15 زیر آن.",
          "requirements": [
            "تا هدف 4225.77 دست‌کم 1.5R فضا باقی مانده باشد"
          ]
        },
        {
          "id": "xau-break-low-short",
          "name": "شکست معتبر کف جمعه",
          "direction": "short",
          "kind": "ادامه روند",
          "triggerLevelId": "xau-friday-low",
          "targetLevelIds": [
            "xau-target-down-1",
            "xau-target-down-2"
          ],
          "invalidationLevelId": "xau-friday-low",
          "entryMethod": "بسته‌شدن M15 زیر سطح، retest ناموفق از پایین و ساختار نزولی M5.",
          "confirmation": [
            "کلوز M15 زیر حمایت",
            "retest از پایین ناموفق باشد",
            "M5 lower-high / lower-low بسازد"
          ],
          "stopMethod": "بالای swing بی‌اعتباری؛ بافر طبق نوسان/اسپرد.",
          "invalidation": "reclaim پایدار کف جمعه و شکل‌گیری ساختار صعودی.",
          "requirements": [
            "فاصله تا حمایت/هدف بعدی برای حداقل 1.5R کافی باشد"
          ]
        }
      ]
    },
    {
      "symbol": "EURUSD",
      "name": "یورو/دلار",
      "priority": 2,
      "bias": "فشار نزولی مشروط",
      "biasKey": "short",
      "digits": 5,
      "referenceLevelId": "eur-close",
      "note": "فروش روی شکست تأییدشده یا ریجکت مقاومت مقدم است؛ خرید فقط با reclaim و تغییر ساختار.",
      "levels": [
        {
          "id": "eur-target-up-2",
          "label": "مقاومت بعدی · ۶ اکتبر",
          "price": 1.1277,
          "type": "target",
          "date": "2026-10-06"
        },
        {
          "id": "eur-target-up-1",
          "label": "مقاومت تاریخی · ۷ اکتبر",
          "price": 1.1255,
          "type": "target",
          "date": "2026-10-07"
        },
        {
          "id": "eur-friday-high",
          "label": "سقف جمعه · مقاومت اولیه",
          "price": 1.1243,
          "type": "resistance",
          "date": "2026-10-09"
        },
        {
          "id": "eur-close",
          "label": "بسته‌شدن جمعه · مرجع تاریخی",
          "price": 1.12015,
          "type": "reference",
          "date": "2026-10-09"
        },
        {
          "id": "eur-friday-low",
          "label": "کف جمعه · حمایت اولیه",
          "price": 1.1186,
          "type": "support",
          "date": "2026-10-09"
        },
        {
          "id": "eur-support-next",
          "label": "حمایت ۸ اکتبر",
          "price": 1.117,
          "type": "support",
          "date": "2026-10-08"
        },
        {
          "id": "eur-support-cluster-a",
          "label": "حمایت ۷ اکتبر",
          "price": 1.1164,
          "type": "support",
          "date": "2026-10-07"
        },
        {
          "id": "eur-support-cluster-b",
          "label": "کف ۵ اکتبر",
          "price": 1.116,
          "type": "support",
          "date": "2026-10-05"
        }
      ],
      "scenarios": [
        {
          "id": "eur-pullback-short",
          "name": "ریجکت مقاومت پس از پولبک",
          "direction": "short",
          "kind": "ادامه فشار نزولی",
          "triggerLevelId": "eur-friday-high",
          "targetLevelIds": [
            "eur-close",
            "eur-friday-low"
          ],
          "invalidationLevelId": "eur-friday-high",
          "entryMethod": "ریجکت زیر 1.12430 یا sweep سقف آسیا؛ شکست کف فرعی M5 و retest نزولی.",
          "confirmation": [
            "ناتوانی در تثبیت بالای مقاومت",
            "شکست کف فرعی M5",
            "retest نزولی قابل مشاهده"
          ],
          "stopMethod": "بالای سقف sweep با بافر اسپرد.",
          "invalidation": "reclaim پایدار 1.12430.",
          "requirements": [
            "فشار دلار و ساختار H1 را هم‌زمان بررسی کن",
            "فضای واقعی تا حمایت بعدی برای حداقل 1.5R لازم است"
          ]
        },
        {
          "id": "eur-break-low-short",
          "name": "شکست کف جمعه",
          "direction": "short",
          "kind": "شکست و retest",
          "triggerLevelId": "eur-friday-low",
          "targetLevelIds": [
            "eur-support-next",
            "eur-support-cluster-a",
            "eur-support-cluster-b"
          ],
          "invalidationLevelId": "eur-friday-low",
          "entryMethod": "بسته‌شدن M15 زیر 1.11860 و retest ناموفق از پایین.",
          "confirmation": [
            "close M15 زیر حمایت",
            "retest از پایین ناموفق بماند",
            "حرکت دلار خلاف سناریو نباشد"